paragraph,Text
<PARAGRAPH 6.3.5.3.>,"When a manufacturer supplies his vehicle with safety-belts, the corresponding belt anchorages may, at the request of the manufacturer, be submitted only to a test in which the loads are transmitted to them by means of a device reproducing the geometry of the type of belts to be attached to these anchorages."
<PARAGRAPH 6.3.6.>,"If no upper belt anchorages are provided for the outboard seats and the centre seats, the lower belt anchorages shall be submitted to the test prescribed in Paragraph-6.4.3., in which the loads are transmitted to these anchorages by means of a device reproducing the geometry of a lap belt."
<PARAGRAPH 6.3.7.>,"If the vehicle is designed to accept other devices which do not enable the straps to be directly attached to belt anchorages without intervening sheaves, etc. or which require belt anchorages supplementary to those mentioned in Paragraph-5.3., the safety-belt or an arrangement of wires, sheaves, etc. representing the equipment of the safety-belt, shall be attached by such a device to the belt anchorages in the vehicle and the belt anchorages shall be subjected to the tests prescribed in Paragraph-6.4., as appropriate."
<PARAGRAPH 6.3.8.>,"A test method other than those prescribed in Paragraph-6.3. may be used, but evidence must be furnished that it is equivalent."
<PARAGRAPH 6.4.>,Particular test requirements for seat belt anchorages
<PARAGRAPH 6.4.1.>,Test in configuration of a three-point belt incorporating a retractor having a pulley or strap guide at the upper belt anchorage
<PARAGRAPH 6.4.1.1.>,"A special pulley or guide for the wire or strap appropriate to transmit the load from the traction device, or the pulley or strap guide supplied by the manufacturer shall be fitted to the upper belt anchorage."
<PARAGRAPH 6.4.1.2.>,"A test load of 1,350 daN ± 20 daN shall be applied to a traction device (see Annex-5, Figure_2) attached to the belt anchorages of the same belt, by means of a device reproducing the geometry of the upper torso strap of such a safety-belt. In the case of vehicles of categories other than M1 and N1, the test load shall be 675 ± 20 daN, except that for M3 and N3 vehicles the test load shall be 450 ± 20 daN."
<PARAGRAPH 6.4.1.3.>,"At the same time a tractive force of 1,350 daN ± 20 daN shall be applied to a traction device (see Annex-5, Figure_1) attached to the two lower belt anchorages. In the case of vehicles of categories other than M1 and N1, the test load shall be 675 ± 20 daN, except that for M3 and N3 vehicles the test load shall be 450 ± 20 daN."
<PARAGRAPH 6.4.2.>,Test in configuration of a three-point belt without retractor or with a retractor at the upper belt anchorage
<PARAGRAPH 6.4.2.1.>,"A test load of 1,350 daN ± 20 daN shall be applied to a traction device (see Annex-5, Figure_2) attached to the upper belt anchorage and to the opposite lower belt anchorage of the same belt using, if supplied by the manufacturer, a retractor fixed at the upper belt anchorage. In the case of vehicles of categories other than M1 and N1, the test load shall be 675 ± 20 daN, except that for M3 and N3 vehicles the test load shall be 450 ± 20 daN."
<PARAGRAPH 6.4.2.2.>,"At the same time a tractive force of 1,350 daN ± 20 daN shall be applied to a traction device (see Annex-5, Figure_1) attached to the lower belt anchorages. In the case of vehicles of categories other than M1 and N1, the test load shall be 675 ± 20 daN, except that for M3 and N3 vehicles the test load shall be 450 ± 20 daN."
<PARAGRAPH 6.4.3.>,"Test in configuration of a lap belt A test load of 2,225 daN ± 20 daN shall be applied to a traction device (see Annex-5, Figure_1) attached to the two lower belt anchorages. In the case of vehicles of categories other than M1 and N1, the test load shall be 1,110 ± 20 daN, except that for M3 and N3 vehicles the test load shall be 740 ± 20 daN."
<PARAGRAPH 6.4.4.>,Test for belt anchorages located wholly within the seat structure or dispersed between the vehicle structure and the seat structure
<PARAGRAPH 6.4.4.1.>,"The test specified in Paragraph-6.4.1. Paragraph-6.4.2. Paragraph-6.4.3. above shall be performed, as appropriate, at the same time superimposing for each seat and for each group of seats a force as stated below."
<PARAGRAPH 6.4.4.2.>,"The loads indicated in Paragraph-6.4.1. Paragraph-6.4.2. Paragraph-6.4.3 above shall be supplemented by a force equal to 20 times the mass of the complete seat. The inertia load shall be applied to the seat or to the relevant parts of the seat corresponding to the physical effect of the mass of the seat in question to the seat anchorages. The determination of the additional applied load or loads and the load distribution shall be made by the manufacturer and agreed by the Technical Service. In the case of vehicles in categories M2 and N2, this force must be equal to 10 times the mass of the complete seat; for categories M3 and N3 it shall be equal to 6.6 times the mass of the complete seat."
<PARAGRAPH 6.4.5.>,Test in configuration of a special-type belt
<PARAGRAPH 6.4.5.1.>,"A test load of 1,350 ± 20 daN shall be applied to a traction device (see Annex-5, Figure_2) attached to the belt anchorages of such a safety-belt by means of a device reproducing the geometry of the upper torso strap or straps."
<PARAGRAPH 6.4.5.2.>,"At the same time, a tractive force of 1,350 ± 20 daN shall be applied to a traction device (see Annex-5, Figure_3) attached to the two lower belt anchorages."
<PARAGRAPH 6.4.5.3.>,"In the case of vehicles of categories other than M1 and N1, this test load shall be 675 ± 20 daN, except that for M3 and N3 vehicles the test load shall be 450 ± 20 daN."
<PARAGRAPH 6.4.6.>,Test in the case of rearward-facing seats
<PARAGRAPH 6.4.6.1.>,"The anchorage points shall be tested according to the forces prescribed in Paragraph-6.4.1. Paragraph-6.4.2. Paragraph-6.4.3., as appropriate. In each case the test load shall correspond to the load prescribed for M3 or N3 vehicles."
<PARAGRAPH 6.4.6.2.>,"The test load shall be directed forward in relation to the seating position in question, corresponding to the procedure prescribed in Paragraph-6.3."
<PARAGRAPH 6.4.7.>,Test in the case of side-facing seats
<PARAGRAPH 6.4.7.1.>,The anchorage points shall be tested according to the forces prescribed in Paragraph-6.4.3. for M3 vehicles.
<PARAGRAPH 6.4.7.2.>,"The test load shall be directed forward in relation to the vehicle, corresponding to the procedure prescribed in Paragraph-6.3. In the case that side-facing seats are grouped together on a basic structure, the safety-belt anchorage points of each seating position in the group shall be tested separately. In addition the basic structure has to be tested as described in Paragraph-6.4.8."
<PARAGRAPH 6.4.7.3.>,"Traction device adapted for the test of side-facing seats is shown in Annex-5, Figure_1b."
<PARAGRAPH 6.4.8.>,Test of the basic structure of side-facing seats
<PARAGRAPH 6.4.8.1.>,The basic structure of a side-facing seat or a group of side-facing seats shall be tested according to the forces as prescribed in Paragraph-6.4.3. for M3 vehicles.
<PARAGRAPH 6.4.8.2.>,"The test load shall be directed forward in relation to the vehicle, corresponding to the procedure prescribed in Paragraph-6.3. In the case that side-facing seats are grouped together the basic structure shall be tested simultaneously for each seating position in the group."
<PARAGRAPH 6.4.8.3.>,The point of application of the forces prescribed in Paragraph-6.4.3. Paragraph-6.4.4. shall be as close as possible to the H-Point and on the line defined by a horizontal plane and a vertical transverse plane through the relevant H-Point of each seating position.
<PARAGRAPH 6.5.>,"In the case of a group of seats as described in Paragraph-1. of Annex-7, the dynamic test of Annex-7 can be performed, at the option of the car manufacturer, as an alternative to the static test prescribed in Paragraph-6.3. Paragraph-6.4."
<PARAGRAPH 6.6.>,Static test requirements.
<PARAGRAPH 6.6.1.>,"The strength of the ISOFIX anchorage systems shall be tested applying the forces, as prescribed in Paragraph-6.6.4.3., to the static force application device (SFAD) with ISOFIX attachments well engaged. In case of ISOFIX top tether anchorage an additional test shall be performed as prescribed in Paragraph-6.6.4.4. All the ISOFIX positions of a same seat row, which can be used simultaneously, shall be tested simultaneously."
<PARAGRAPH 6.6.2.>,"The test may be carried out either on a completely finished vehicle or on sufficient parts of the vehicle so as to be representative of the strength and rigidity of the vehicle structure. Windows and doors may be fitted or not and closed or not. Any fitting normally provided and likely to contribute to the vehicle structure may be fitted. The test may be restricted to the ISOFIX position relating to only one seat or group of seats on the condition that: (a) The ISOFIX position concerned have the same structural characteristics as the ISOFIX position relating to the other seats or group of seats and, (b) Where such ISOFIX positions are fitted totally or partially on the seat or group of seats, the structural characteristics of the seat or group of seats are the same as those for the other seats or groups of seats."
<PARAGRAPH 6.6.3.>,"If the seats and head restraint are adjustable, they shall be tested in the position defined by the technical service within the limited range prescribed by the car manufacturer as provided in Annex-3 of Annex-17 of Regulation-No._16."
<PARAGRAPH 6.6.4.>,"Forces, directions and excursion limits."
<PARAGRAPH 6.6.4.1.>,A force of 135 N ± 15 N shall be applied to the centre of the lower front crossbar of the SFAD in order to adjust the fore-aft position of the SFAD rearward extension to remove any slack or tension between the SFAD and its support.
<PARAGRAPH 6.6.4.2.>,"Forces shall be applied to the static force application device (SFAD) in forward and oblique directions according to Table_1. Table_1 Directions of test forces Forward 0° 5° 8 kN 0.25 kN Oblique 75° 5° (to both sides of straight forward, or if any worst case side, or if both side are symmetric, only one side) 5 kN 0.25 kN Each of these tests may be performed on different structures if the manufacturer so requests. Forces in the forward direction shall be applied with an initial force application angle of 10 ± 5° above the horizontal. Oblique forces shall be applied horizontally 0° ± 5°. A pre-load force of 500 N ± 25 N shall be applied at the prescribed loading point X indicated in Figure_2 of Annex-9. Full application of the load shall be achieved as rapidly as possible, and within a maximum load application time of 30 seconds. However, the manufacturer may request the application of the load to be achieved within 2 seconds. The force shall be maintained for a minimum period of 0.2 s. All measurements shall be made according to ISO 6487 with CFC of 60 Hz or any equivalent method."
<PARAGRAPH 6.6.4.3.>,Tests of ISOFIX anchorages system only:
<PARAGRAPH 6.6.4.3.1.>,Forward direction force test: Horizontal longitudinal excursion (after pre-load) of point X of SFAD during application of the 8 kN 0.25 kN force shall be limited to 125 mm and permanent deformation including partial rupture or breakage of any ISOFIX low anchorage or surrounding area shall not constitute failure if the required force is sustained for the specified time.
<PARAGRAPH 6.6.4.3.2.>,Oblique direction force test: Excursion in the direction of the force (after pre-load) of point X of SFAD during application of the 5 kN 0.25 kN force shall be limited to 125 mm and permanent deformation including partial rupture or breakage of any ISOFIX low anchorage or surrounding area shall not constitute failure if the required force is sustained for the specified time.
<PARAGRAPH 6.6.4.4.>,"Test of ISOFIX anchorages systems and ISOFIX top tether anchorage: A tension pre-load of 50 N 5 N must be applied between the SFAD and the top-tether anchorage. Horizontal excursion (after pre-load) of point X during application of the 8 kN 0.25 kN force shall be limited to 125 mm and permanent deformation including partial rupture or breakage of any ISOFIX low anchorage and top tether anchorage, or surrounding area shall not constitute failure if the required force is sustained for the specified time. Table_2 Excursions limits Force direction Maximum excursion of point X of SFAD Forward 125 mm longitudinal Oblique 125 mm force direction"
<PARAGRAPH 6.6.5.>,Additional forces
<PARAGRAPH 6.6.5.1.>,"Seat inertia forces. For the installation position where the load is transferred into a vehicle seat assembly, and not directly into the vehicle structure, a test shall be carried out to ensure that the strength of the vehicle seat anchorages to the vehicle structure is sufficient. In this test, a force equal to 20 times the mass of the relevant parts of the seat assembly shall be applied horizontally and longitudinally in a forward direction to the seat or the relevant part of the seat assembly corresponding to the physical effect of the mass of the seat in question to the seat anchorages. The determination of the additional applied load or loads and the load distribution shall be made by the manufacturer and agreed by the Technical Service. At the request of the manufacturer, the additional load can be applied at the X point of SFAD during the static tests described above. If the top tether anchorage is integrated to the vehicle seat, this test shall be performed with the ISOFIX top tether strap. No breakage shall occur and excursion requirements given in the Table_2 have to be fulfilled. Note: This test does not have to be performed in case of any anchorage of the vehicle safety-belt system is integrated to the vehicle seat structure, and the vehicle seat is already tested and approved to meet the anchorage load tests required by this Regulation for adult passenger restraint."
<PARAGRAPH 7.>,Inspection during and after static tests for safety- belt anchorages
<PARAGRAPH 7.1.>,"All the anchorages shall be capable of withstanding the test prescribed in Paragraph-6.3. Paragraph-6.4. Permanent deformation, including partial rupture or breakage of any anchorage or surrounding area, shall not constitute failure if the required force is sustained for the specified time. During the test, the minimum spacings for the effective lower belt anchorages specified in Paragraph-5.4.2.5. and the requirements of Paragraph-5.4.3.6. for effective upper belt anchorages shall be respected."
<PARAGRAPH 7.1.1.>,"For vehicles of category M1 of a total permissible mass not exceeding 2.5 tonnes, if the upper safety-belt anchorage is attached to the seat structure, the effective upper safety-belt anchorage shall not be displaced during the test forward of a transverse plane passing through the R point and point C of the seat in question (see Figure_1 of Annex-3 to this Regulation) For vehicles other than mentioned above, the effective upper safety-belt anchorage shall not be displaced during the test forward of a transverse plane inclined 10° in forward direction and passing through the R point of the seat. The maximum displacement of the effective upper anchorage point shall be measured during the test. If the displacement of the effective upper anchorage point exceeds the above-mentioned limitation, the manufacturer shall demonstrate to the satisfaction of the technical service that there is no danger to the occupant. As an example, the test procedure according to Regulation-No._94 or a sled test with corresponding pulse may be carried out to demonstrate a sufficient survival space."
<PARAGRAPH 7.2.>,"In vehicles where such devices are used, the displacement and locking devices enabling the occupants of all seats to leave the vehicle must still be operable by hand after the tractive force was removed."
<PARAGRAPH 7.3.>,After testing any damage to the anchorages and structures supporting load during tests shall be noted.
<PARAGRAPH 7.4.>,"By derogation, the upper anchorages fitted to one or more seats of vehicles of category M3 and those of category M2 with a maximum mass exceeding 3.5 tonnes, which meet the requirements of Regulation-No._80, need not to comply with the requirements of Paragraph-7.1. concerning compliance with Paragraph-5.4.3.6."
<PARAGRAPH 8.>,Modifications and extension of approval of the vehicle type
<PARAGRAPH 8.1.>,Every modification of the vehicle type shall be notified to the Type Approval Authority which approved the vehicle type. The Authority may then either:
<PARAGRAPH 8.1.1.>,Consider that the modifications made are unlikely to have an appreciable adverse effect and that in any case the vehicle still complies with the requirements; Paragraph-8.1.2. Require a further test report from the technical service responsible for conducting the tests.
<PARAGRAPH 8.2.>,"Confirmation or refusal of approval, specifying the alterations, shall be communicated by the procedure specified in Paragraph-4.3. above to the Parties to the Agreement which apply this Regulation."
<PARAGRAPH 8.3.>,The competent authority issuing the extension of approval shall assign a series number for such an extension and inform thereof the other Parties to the 1958 Agreement applying this Regulation by means of a communication form conforming to the model in Annex-1 to this Regulation.
<PARAGRAPH 9.>,"Conformity of production The conformity of production procedures shall comply with those set out in the Agreement, Annex-2 (-), with the following requirements:"
<PARAGRAPH 9.1.>,Every vehicle bearing an approval mark as prescribed under this Regulation shall conform to the vehicle type approved with regard to details affecting the characteristics of the safety-belt anchorages and the ISOFIX anchorages system and ISOFIX top tether anchorage.
<PARAGRAPH 9.2.>,"In order to verify conformity as prescribed in Paragraph-9.1. above, a sufficient number of serially-produced vehicles bearing the approval mark required by this Regulation shall be subjected to random checks."
<PARAGRAPH 9.3.>,"As a general rule the checks as aforesaid shall be confined to the taking of measurements. However, if necessary, the vehicles shall be subjected to some of the tests described in Paragraph-6. above, selected by the technical service conducting approval tests."
<PARAGRAPH 10.>,Penalties for non-conformity of production
<PARAGRAPH 10.1.>,The approval granted in respect of a vehicle type pursuant to this Regulation may be withdrawn if the requirement laid down in Paragraph-9.1. above is not complied with or if its safety-belt anchorages or the ISOFIX anchorages system and ISOFIX top tether anchorage failed to pass the checks prescribed in Paragraph-9. above.
<PARAGRAPH 10.2.>,"If a Contracting Party to the Agreement which applies this Regulation withdraws an approval it has previously granted, it shall forthwith so notify the other Contracting Parties applying this Regulation, by means of a communication form conforming to the model in Annex-1 to this Regulation."
<PARAGRAPH 11.>,Operating instructions The national authorities may require the manufacturers of vehicles registered by them to state clearly in the instructions for operating the vehicle
<PARAGRAPH 11.1.>,"Where the anchorages are; Paragraph-11.2. For what types of belts the anchorages are intended (see Annex-1, item 5)."
<PARAGRAPH 12.>,"Production definitively discontinued If the holder of the approval completely ceases to manufacture a type of safety-belt anchorages or a type of ISOFIX anchorages system and ISOFIX top tether anchorage approved in accordance with this Regulation, he shall so inform the authority which granted the approval. Upon receiving the relevant communication that authority shall inform thereof the other Contracting Parties to the 1958 Agreement, which apply this Regulation by means of a communication form conforming to the model in Annex-1 to this Regulation."
<PARAGRAPH 13.>,"Names and addresses of Technical Services responsible for conducting approval tests and of Type Approval Authorities The Contracting Parties to the 1958 Agreement applying this Regulation shall communicate to the United Nations secretariat the names and addresses of the Technical Services responsible for conducting approval tests and of the Type Approval Authorities which grant approval and to which forms certifying approval or extension, or refusal or extension or withdrawal of approval, issued in other countries, are to be sent."
<PARAGRAPH 14.>,Transitional provisions
<PARAGRAPH 14.1.>,"As from the official date of entry into force of the 06 series of amendments, no Contracting Party applying this Regulation shall refuse to grant ECE approvals under this Regulation as amended by the 06 series of amendments."
<PARAGRAPH 14.2.>,"As from 2 years after the enter into force of the 06 series of amendments to this Regulation, Contracting Parties applying this Regulation shall grant ECE type approvals only if the requirements of this Regulation, as amended by the 06 series of amendments, are satisfied."
<PARAGRAPH 14.3.>,"As from 7 years after the enter into force of the 06 series of amendments to this Regulation, Contracting Parties applying this Regulation may refuse to recognize approvals which were not granted in accordance with the 06 series of amendments to this Regulation. However, existing approvals of the vehicle categories which are not affected by the 06 series of amendments to this Regulation shall remain valid and Contracting Parties applying this Regulation shall continue to accept them."
<PARAGRAPH 14.4.>,"For vehicles not affected Paragraph-7.1.1. above, approvals granted according to the 04 series of amendments to this Regulation shall remain valid."
<PARAGRAPH 14.5.>,"For vehicles not affected by Supplement_4 to the 05 series of amendments to this Regulation the existing approvals shall remain valid, if they had been granted in compliance with the 05 series of amendments, up to its Supplement_3."
<PARAGRAPH 14.6.>,"As from the official date of entry into force of Supplement_5 to the 05 series of amendments, no Contracting Party applying this Regulation shall refuse to grant approvals under this Regulation as modified by Supplement_5 to the 05 series of amendments."
<PARAGRAPH 14.7.>,"For vehicles not affected by Supplement_5 to the 05 series of amendments to this Regulation the existing approvals shall remain valid, if they had been granted in compliance with the 05 series of amendments, up to its Supplement_3."
<PARAGRAPH 14.8.>,"As from 20-February-2005 for vehicles of category M1, Contracting Parties applying this Regulation shall grant approvals only if the requirements of this Regulation, as amended by Supplement_5 to the 05 series of amendments, are satisfied."
<PARAGRAPH 14.9.>,"As from 20-February-2007 for vehicles of category M1, Contracting Parties applying this Regulation may refuse to recognize approvals which were not granted in accordance with Supplement_5 to the 05 series of amendments to this Regulation."
<PARAGRAPH 14.10.>,"As from 16-July-2006 for vehicles of category N, Contracting Parties applying this Regulation shall grant approval only if the vehicle type satisfies the requirements of this Regulation as amended by the Supplement_5 to the 05 series of amendments."
<PARAGRAPH 14.11.>,"As from 16-July-2008 for vehicles of category N, Contracting Parties applying this Regulation may refuse to recognize approvals not granted in accordance with Supplement_5 to the 05 series of amendments to this Regulation."
<PARAGRAPH 14.12.>,"As from the official date of entry into force of the 07 series of amendments, no Contracting Party applying this Regulation shall refuse to grant approvals under this Regulation as amended by the 07 series of amendments."
<PARAGRAPH 14.13.>,"As from 24 months after the date of entry into force of the 07 series of amendments, Contracting Parties applying this Regulation shall grant approvals only if the requirements of this Regulation, as amended by the 07 series of amendments, are satisfied."
<PARAGRAPH 14.14.>,"As from 36 months after the date of entry into force of the 07 series of amendments, Contracting Parties applying this Regulation may refuse to recognize approvals which were not granted in accordance with the 07 series of amendments to this Regulation."
<PARAGRAPH 14.15.>,"Notwithstanding Paragraph-14.13. Paragraph-14.14., approvals of the vehicle categories to the preceding series of amendments to the Regulation which are not affected by the 07 series of amendments shall remain valid and Contracting Parties applying the Regulation shall continue to accept them."
<PARAGRAPH 14.16.>,"As long as there are no requirements concerning the compulsory fitting of safety-belt anchorages for folding seats in their national requirements at the time of acceding to this Regulation, Contracting Parties may continue to allow this non-fitment for the purpose of national approval and in this case these bus categories cannot be type approved under this Regulation."
<PARAGRAPH 14.17.>,"As from the official date of entry into force of Supplement_2 to the 07 series of amendments, no Contracting Party applying this Regulation shall refuse to grant type approval under this Regulation as amended by Supplement_2 to the 07 series of amendments."
<PARAGRAPH 14.18.>,"As from 12 months after the official date of entry into force of Supplement_2 to the 07 series of amendments, Contracting Parties applying this Regulation shall grant type approvals only to those types of vehicle which comply with the requirements of this Regulation as amended by Supplement_2 to the 07 series of amendments."
