paragraph,Text
<PARAGRAPH 6.3.2.2.>,"If measurements are made using the method described in Annex-5 using a vehicle-to-antenna spacing of 3.0 ± 0.05 m, the limits shall be 38 dB microvolts/m in the 30 to 230 MHz frequency band and 45 dB microvolts/m in the 230 to 1,000 MHz frequency band."
<PARAGRAPH 6.3.2.3.>,"On the vehicle representative of its type, the measured values, expressed in dB microvolts/m, shall be below the type approval limit."
<PARAGRAPH 6.3.2.4.>,"Notwithstanding the limits defined in Paragraph-6.3.2.1. Paragraph-6.3.2.2. Paragraph-6.3.2.3. of this Regulation, if, during the initial step described in Paragraph-1.3. of Annex-5, the signal strength measured at the vehicle broadcast radio antenna is less than 20 dB micro-volts over the frequency range 76 to 108 MHz measured with an average detector, then the vehicle shall be deemed to comply with the limits for narrowband emissions and no further testing will be required."
<PARAGRAPH 6.4.>,Specifications concerning immunity of vehicles to electromagnetic radiation
<PARAGRAPH 6.4.1.>,Method of testing The immunity to electromagnetic radiation of the vehicle representative of its type shall be tested by the method described in Annex-6.
<PARAGRAPH 6.4.2.>,Vehicle immunity type approval limits
<PARAGRAPH 6.4.2.1.>,"If tests are made using the method described in Annex-6, the field strength shall be 30 volts/m rms (root mean squared) in over 90 per cent of the 20 to 2,000 MHz frequency band and a minimum of 25 volts/m rms over the whole 20 to 2,000 MHz frequency band."
<PARAGRAPH 6.4.2.2.>,"The vehicle representative of its type shall be considered as complying with immunity requirements if, during the tests performed in accordance with Annex-6, there shall be no degradation of performance of ""immunity related functions"", according to Paragraph-2.1. of Annex-6."
<PARAGRAPH 6.5.>,Specification concerning broadband electromagnetic interference generated by ESAs
<PARAGRAPH 6.5.1.>,Method of measurement The electromagnetic radiation generated by the ESA representative of its type shall be measured by the method described in Annex-7.
<PARAGRAPH 6.5.2.>,ESA broadband type approval limits
<PARAGRAPH 6.5.2.1.>,"If measurements are made using the method described in Annex-7, the limits shall be 62 to 52 dB microvolts/m in the 30 to 75 MHz frequency band, this limit decreasing logarithmically with frequencies above 30 MHz, and 52 to 63 dB microvolts/m in the 75 to 400 MHz band, this limit increasing logarithmically with frequencies above 75 MHz as shown in Annex-6 to this Regulation. In the 400 to 1,000 MHz frequency band the limit remains constant at 63 dB microvolts/m."
<PARAGRAPH 6.5.2.2.>,"On the ESA representative of its type, the measured values, expressed in dB microvolts/m, shall be below the type approval limits."
<PARAGRAPH 6.6.>,Specifications concerning narrowband electromagnetic interference generated by ESAs
<PARAGRAPH 6.6.1.>,Method of measurement The electromagnetic radiation generated by the ESA representative of its type shall be measured by the method described in Annex-8.
<PARAGRAPH 6.6.2.>,ESA narrowband type approval limits
<PARAGRAPH 6.6.2.1.>,"If measurements are made using the method described in Annex-8, the limits shall be 52 to 42 dB microvolts/m in the 30 to 75 MHz frequency band, this limit decreasing logarithmically with frequencies above 30 MHz, and 42 to 53 dB microvolts/m in the 75 to 400 MHz band, this limit increasing logarithmically with frequencies above 75 MHz as shown in Annex-7. In the 400 to 1,000 MHz frequency band the limit remains constant at 53 dB microvolts/m."
<PARAGRAPH 6.6.2.2.>,"On the ESA representative of its type, the measured value, expressed in dB microvolts/m shall be below the type approval limits."
<PARAGRAPH 6.7.>,Specifications concerning the emission of transient conducted disturbances generated by ESAs on 12/24 V supply lines
<PARAGRAPH 6.7.1.>,Method of testing The emission of ESA representative of its type shall be tested by the method(s) according to ISO 7637-2 as described in Annex-10 for the levels given in Table_1. Table_1 Maximum allowed pulse amplitude Maximum allowed pulse amplitude for Polarity of pulse amplitude Vehicles with 12 V systems Vehicles with 24 V systems Positive +75 V +150 V Negative 100 V 450 V
<PARAGRAPH 6.8.>,Specifications concerning immunity of ESAs to electromagnetic radiation
<PARAGRAPH 6.8.1.>,Method(s) of testing The immunity to electromagnetic radiation of the ESA representative of its type shall be tested by the method(s) chosen from those described in Annex-9.
<PARAGRAPH 6.8.2.>,ESA immunity type approval limits
<PARAGRAPH 6.8.2.1.>,"If tests are made using the methods described in Annex-9, the immunity test levels shall be 60 volts/m root-mean-square (rms) for the 150 mm stripline testing method, 15 volts/m rms for the 800 mm stripline testing method, 75 volts/m rms for the Transverse Electromagnetic Mode (TEM) cell testing method, 60 mA rms for the bulk current injection (BCI) testing method and 30 volts/m rms for the free field testing method in over 90 per cent of the 20 to 2,000 MHz frequency band, and to a minimum of 50 volts/m rms for the 150 mm stripline testing method Paragraph-12.5 volts/m rms for the 800 mm stripline testing method Paragraph-62.5 volts/m rms, for the TEM cell testing method, 50 mA rms for the bulk current injection (BCI) testing method and 25 volts/m rms for the free field testing method over the whole 20 to 2,000 MHz frequency band."
<PARAGRAPH 6.8.2.2.>,"The ESA representative of its type shall be considered as complying with immunity requirements if, during the tests performed in accordance with Annex-9, there shall be no degradation of performance of ""immunity related functions""."
<PARAGRAPH 6.9.>,Specifications concerning the immunity of ESAs to transient disturbances conducted along 12/24 V supply lines
<PARAGRAPH 6.9.1.>,Method of testing The immunity of ESA representative of this type shall be tested by the method(s) according to ISO 7637-2 as described in Annex-10 with the test levels given in Table_2. Table_2 Immunity of ESA Test pulse number Immunity test level Functional status for systems: Related to immunity related functions Not related to immunity related functions 1 III C D 2a III B D 2b III C D 3a/3b III A D 4 III B D Test pulse number Immunity test level Functional status for systems: Related to immunity related functions Not related to immunity related functions (for ESA which shall be operational during engine start phases) C (for other ESA)
<PARAGRAPH 6.10.>,Exceptions
<PARAGRAPH 6.10.1.>,"Where a vehicle or electrical/electronic system or ESA does not include an electronic oscillator with an operating frequency greater than 9 kHz, it shall be deemed to comply with Paragraph-6.3.2. Paragraph-6.6.2. and with Annexes 5 Paragraph-8."
<PARAGRAPH 6.10.2.>,"Vehicles which do not have electrical/electronic systems with ""immunity related functions"" need not be tested for immunity to radiated disturbances and shall be deemed to comply with Paragraph-6.4. and with Annex-6 to this Regulation."
<PARAGRAPH 6.10.3.>,ESAs with no immunity related functions need not be tested for immunity to radiated disturbances and shall be deemed to comply with Paragraph-6.8. and with Annex-9 to this Regulation.
<PARAGRAPH 6.10.4.>,"Electrostatic discharge For vehicles fitted with tyres, the vehicle body/chassis can be considered to be an electrically isolated structure. Significant electrostatic forces in relation to the vehicle's external environment only occur at the moment of occupant entry into or exit from the vehicle. As the vehicle is stationary at these moments, no type approval test for electrostatic discharge is deemed necessary."
<PARAGRAPH 6.10.5.>,"Emission of transient conducted disturbances generated by ESAs on 12/24 V supply lines. ESAs that are not switched, contain no switches or do not include inductive load need not be tested for transient conducted emission and shall be deemed to comply with Paragraph-6.7."
<PARAGRAPH 6.10.6.>,"The loss of function of receivers during the immunity test, when the test signal is within the receiver bandwidth (RF exclusion band) as specified for the specific radio service/product in the harmonized international EMC standard, does not necessarily lead to fail criteria."
<PARAGRAPH 6.10.7.>,RF transmitters shall be tested in the transmit mode. Wanted emissions (e.g. from RF transmitting systems) within the necessary bandwidth and out of band emissions are disregarded for the purpose of this Regulation. Spurious emissions are subject to this Regulation.
<PARAGRAPH 6.10.7.1.>,"""Necessary bandwidth"": For a given class of emission, the width of the frequency band which is just sufficient to ensure the transmission of information at the rate and with the quality required under specified conditions (Article 1, No.1.152 of the International Telecommunication Union (ITU) Radio Regulations)."
<PARAGRAPH 6.10.7.2.>,"""Out-of-band Emissions"": Emission on a frequency or frequencies immediately outside the necessary bandwidth which results from the modulation process, but excluding spurious emissions (Article 1, No.1.144 of the ITU Radio Regulations)."
<PARAGRAPH 6.10.7.3.>,"""Spurious emission"": In every modulation process additional undesired signals exist. They are summarized under the expression ""spurious emissions"". Spurious emissions are emissions on a frequency or frequencies, which are outside the necessary bandwidth and the level of which may be reduced without affecting the corresponding transmission of information. Spurious emissions include harmonic emissions, parasitic emissions, intermodulation products and frequency conversion products, but exclude out-of-band emissions (Article 1 No.1.145 of the ITU Radio Regulations)."
<PARAGRAPH 7.>,"Additional specifications in the configuration ""REESS charging mode coupled to the power grid"""
<PARAGRAPH 7.1.>,General specifications
<PARAGRAPH 7.1.1.>,"A vehicle and its electrical/electronic system(s) or ESA(s) shall be so designed, constructed and fitted as to enable the vehicle, in configuration ""REESS charging mode coupled to the power grid"", to comply with the requirements of this Regulation."
<PARAGRAPH 7.1.1.1.>,"A vehicle in configuration ""REESS charging mode coupled to the power grid"" shall be tested for radiated emissions, immunity to radiated disturbances, conducted emissions and immunity to conducted disturbances."
<PARAGRAPH 7.1.1.2.>,"ESAs in configuration ""REESS charging mode coupled to the power grid"" shall be tested for radiated and conducted emissions, for immunity to radiated and conducted disturbances."
<PARAGRAPH 7.1.2.>,"Before testing the Technical Service has to prepare a test plan in conjunction with the manufacturer, for the configuration ""REESS charging mode coupled to the power grid"" configuration which contains at least mode of operation, stimulated function(s), monitored function(s), pass/fail criterion (criteria) and intended emissions."
<PARAGRAPH 7.1.3.>,"A vehicle in configuration ""REESS charging mode coupled to the power grid"" should be tested with the charging harness delivered by the manufacturer. In this case, the cable shall be type approved as part of the vehicle."
<PARAGRAPH 7.1.4.>,Artificial networks AC Power mains shall be applied to the vehicle / ESA through 50 µH/50 AMN(s) as defined in Annex-8 clause_4. DC Power mains shall be applied to the vehicle / ESA through 5 µH/50 DC-charging-AN(s) as defined in Annex-8 clause_3. High voltage power line shall be applied to the ESA through a 5 µH/50 HV-AN(s) as defined in Annex-8 clause_2.
<PARAGRAPH 7.2.>,Specifications concerning broadband electromagnetic radiation from vehicles
<PARAGRAPH 7.2.1.>,Method of measurement The electromagnetic radiation generated by the vehicle representative of its type shall be measured using the method described in Annex-4. The method of measurement shall be defined by the vehicle manufacturer in accordance with the Technical Service.
<PARAGRAPH 7.2.2.>,Vehicle broadband type approval limits
<PARAGRAPH 7.2.2.1.>,"If measurements are made using the method described in Annex-4 using a vehicle-to-antenna spacing of 10.0 ± 0.2 m, the limits shall be 32 dB microvolts/m in the 30 to 75 MHz frequency band and 32 to 43 dB microvolts/m in the 75 to 400 MHz frequency band, this limit increasing logarithmically with frequencies above 75 MHz as shown in Annex-2. In the 400 to 1,000 MHz frequency band the limit remains constant at 43 dB microvolts/m."
<PARAGRAPH 7.2.2.2.>,"If measurements are made using the method described in Annex-4 using a vehicle-to-antenna spacing of 3.0 ± 0.05 m, the limits shall be 42 dB microvolts/m in the 30 to 75 MHz frequency band and 42 to 53 dB microvolts/m in the 75 to 400 MHz frequency band, this limit increasing logarithmically with frequencies above 75 MHz as shown in Annex-3. In the 400 to 1,000 MHz frequency band the limit remains constant at 53 dB microvolts/m. On the vehicle representative of its type, the measured values, expressed in dB microvolts/m shall be below the type approval limits."
<PARAGRAPH 7.3.>,Specifications concerning emission of harmonics on AC power lines from vehicles
<PARAGRAPH 7.3.1.>,Method of measurement The harmonics emission on AC power lines generated by the vehicle representative of its type shall be measured using the method described in Annex-11. The method of measurement shall be defined by the vehicle manufacturer in accordance with the Technical Service.
<PARAGRAPH 7.3.2.>,Vehicle type approval limit
<PARAGRAPH 7.3.2.1.>,"If measurements are made using the method described in Annex-11, the limits -3-2 and given in Table_3. Table_3 Harmonic number n Maximum authorized harmonic current A Odd harmonics 3 2.3 5 1.14 7 0.77 9 0.40 11 0.33 13 0.21 0.15x15/n Even harmonics 2 1.08 4 0.43 6 0.30 0.23x8/n"
<PARAGRAPH 7.3.2.2.>,"If measurements are made using the method described in Annex-11, the limits for 61000-3-12, and given in given in Table_4, Table_5 and Table_6. Table_4 Maximum allowed harmonics (input curr single phase or other than balanced three-phase equipment Minimum Rsce Acceptable individual harmonic current In/I1 % Maximum current harmonic ratio % I3 I5 I7 I9 I11 I13 THD PWHD 33 21.6 10.7 7.2 3.8 3.1 2 23 23 66 24 13 8 5 4 3 26 26 120 27 15 10 6 5 4 30 30 250 35 20 13 9 8 6 40 40 41 24 15 12 10 8 47 47 Relative values of even harmonics lower or equal to 12 shall be lower than 16/n %. Even harmonics greater than 12 are taken into account in the Total Harmonic Distorsion (THD) and Partial Weighted Harmonic Distorsion (PWHD) the same way than odd harmonics. Linear interpolation between successive values of Short Circuit Ratio of an Equipment (Rsce) is authorized. Table_5 three-phase equipment Minimum Rsce Acceptable individual harmonic current In/I1 % Maximum current harmonic ratio % I5 I7 I11 I13 THD PWHD 33 10.7 7.2 3.1 2 13 22 66 14 9 5 3 16 25 120 19 12 7 4 22 28 250 31 20 12 7 37 38 40 25 15 10 48 46 Relative values of even harmonics lower or equal to 12 shall be lower than 16/n %. Even harmonics greater than 12 are taken into account in the THD and PWHD the same way than odd harmonics. Linear interpolation between successive values of Rsce is authorized. Table_6 three-phase equipment under specific conditions Minimum Rsce Acceptable individual harmonic current In/I1 % Maximum current harmonic ratio % I5 I7 I11 I13 THD PWHD 33 10.7 7.2 3.1 2 13 22 40 25 15 10 48 46 Relative values of even harmonics lower or equal to 12 shall be lower than 16/n %. Even harmonics greater than 12 are taken into account in the THD and PWHD the same way than odd harmonics"
<PARAGRAPH 7.4.>,"Specifications concerning emission of voltage changes, voltage fluctuations and flicker on AC power lines from vehicles."
<PARAGRAPH 7.4.1.>,"Method of measurement The emission of voltage changes, voltage fluctuations and flicker on AC power lines generated by the vehicle representative of its type shall be measured using the method described in Annex-12. The method of measurement shall be defined by the vehicle manufacturer in accordance with the Technical Service."
<PARAGRAPH 7.4.2.>,Vehicle type approval limit
<PARAGRAPH 7.4.2.1.>,"If measurements are made using the method described in Annex-12, the limits for are those defined in IEC 61000-3-3, paragraph 5: - The value of Pst shall not be greater than 1.0; - The value of Plt shall not be greater than 0.65; - The value of d(t) during a voltage change shall not exceed 3.3 per cent for more than 500 ms; - The relative steady-state voltage change, dc, shall not exceed 3.3 per cent; - The maximum relative voltage change dmax, shall not exceed 6 per cent."
<PARAGRAPH 7.4.2.2.>,"If measurements are made using the method described in Annex-12, the limits connection are those defined in IEC 61000-3-11, paragraph 5: - The value of Pst shall not be greater than 1.0; - The value of Plt shall not be greater than 0.65; - The value of d(t) during a voltage change shall not exceed 3.3 per cent for more than 500 ms; - The relative steady-state voltage change, dc, shall not exceed 3.3 per cent; - The maximum relative voltage change dmax, shall not exceed 6 per cent."
<PARAGRAPH 7.5.>,Specifications concerning emission of radiofrequency conducted disturbances on AC or DC power lines from vehicles
<PARAGRAPH 7.5.1.>,Method of measurement The emission of radiofrequency conducted disturbances on AC or DC power lines generated by the vehicle representative of its type shall be measured using the method described in Annex-13. The method of measurement shall be defined by the vehicle manufacturer in accordance with the Technical Service.
<PARAGRAPH 7.5.2.>,Vehicle type approval limit
<PARAGRAPH 7.5.2.1.>,"If measurements are made using the method described in Annex-13, the limits on AC power lines are those defined in IEC 61000-6-3 and given in Table_7. Table_7 Maximum allowed radiofrequency conducted disturbances on AC power lines Frequency (MHz) Limits and detector 0.15 to 0.5 66 to 56 dBµV (quasi-peak) 56 to 46 dBµV (average) (linearly decreasing with logarithm of frequency) 0.5 to 5 56 dBµV (quasi-peak) 46 dBµV (average) 5 to 30 60 dBµV (quasi-peak) 50 dBµV (average)"
<PARAGRAPH 7.5.2.2.>,"If measurements are made using the method described in Annex-13, the limits on DC power lines are those defined in IEC 61000-6-3 and given in Table_8. Table_8 Maximum allowed radiofrequency conducted disturbances on DC power lines Frequency (MHz) Limits and detector 0.15 to 0.5 79 dBµV (quasi-peak) 66 dBµV (average) 0.5 to 30 73 dBµV (quasi-peak) 60 dBµV (average)"
<PARAGRAPH 7.6.>,Specifications concerning emission of radiofrequency conducted disturbances on wired network port from vehicles
<PARAGRAPH 7.6.1.>,Method of measurement The emission of radiofrequency conducted disturbances on wired network port generated by the vehicle representative of its type shall be measured using the method described in Annex-14. The method of measurement shall be defined by the vehicle manufacturer in accordance with the Technical Service.
<PARAGRAPH 7.6.2.>,Vehicle type approval limit
<PARAGRAPH 7.6.2.1.>,"If measurements are made using the method described in Annex-14, the limits on wired network port are those defined in IEC 61000-6-3 and given in Table_9. Table_9 Maximum allowed radiofrequency conducted disturbances wired network port Frequency (MHz) Voltage limits (detector) Current limits (detector) 0.15 to 0.5 84 to 74 dBµV (quasi-peak) 74 to 64 dBµV (average) (linearly decreasing with logarithm of frequency) 40 to 30 dBµA (quasi-peak) 30 to 20 dBµA (average) (linearly decreasing with logarithm of frequency) 0.5 to 30 74 dBµV (quasi-peak) 64 dBµV (average) 30 dBµA (quasi-peak) 20 dBµA (average)"
<PARAGRAPH 7.7.>,Specifications concerning immunity of vehicles to electromagnetic radiation
<PARAGRAPH 7.7.1.>,Method of testing The immunity to electromagnetic radiation of the vehicle representative of its type shall be tested by the method described in Annex-6.
<PARAGRAPH 7.7.2.>,Vehicle immunity type approval limits
<PARAGRAPH 7.7.2.1.>,"If tests are made using the method described in Annex-6, the field strength shall be 30 volts/m rms (root mean squared) in over 90 per cent of the 20 to 2,000 MHz frequency band and a minimum of 25 volts/m rms over the whole 20 to 2,000 MHz frequency band."
<PARAGRAPH 7.7.2.2.>,"The vehicle representative of its type shall be considered as complying with immunity requirements if, during the tests performed in accordance with Annex-6, there shall be no degradation of performance of ""immunity related functions"", according to Paragraph-2.2. of Annex-6."
<PARAGRAPH 7.8.>,Specifications concerning the immunity of vehicles to Electrical Fast Transient/Burst disturbances conducted along AC and DC power lines.
<PARAGRAPH 7.8.1.>,Method of testing
<PARAGRAPH 7.8.1.1.>,The immunity to Electrical Fast Transient/Burst disturbances conducted along AC and DC power lines of the vehicle representative of its type shall be tested by the method described in Annex-15.
<PARAGRAPH 7.8.2.>,Vehicle immunity type approval limits
<PARAGRAPH 7.8.2.1.>,"If tests are made using the methods described in Annex-15, the immunity test levels, for AC or DC power lines, shall be: ±2 kV test voltage in open circuit, with a rise time (Tr) of 5 ns, and a hold time (Th) of 50 ns and a repetition rate of 5 kHz for at least 1 minute."
<PARAGRAPH 7.8.2.2.>,"The vehicle representative of its type shall be considered as complying with immunity requirements if, during the tests performed in accordance with Annex-15, there shall be no degradation of performance of ""immunity related functions"", according to Paragraph-2.2. of Annex-6."
<PARAGRAPH 7.9.>,Specifications concerning the immunity of vehicles to surge conducted along AC or DC power lines.
<PARAGRAPH 7.9.1.>,Method of testing
<PARAGRAPH 7.9.1.1.>,The immunity to surge conducted along AC/DC power lines of the vehicle representative of its type shall be tested by the method described in Annex-16.
<PARAGRAPH 7.9.2.>,Vehicle immunity type approval limits
<PARAGRAPH 7.9.2.1.>,"If tests are made using the methods described in Annex-16, the immunity test levels shall be: (a) For AC power lines: ±2 kV test voltage in open circuit between line and earth and ±1 kV between lines (pulse 1.2 µs / 50 µs), with a rise time (Tr) of 1.2 µs, and a hold time (Th) of 50 µs. Each surge shall be applied five times with a maximum delay of 1 minute between each pulse. This has to be applied for the following phases: 0, 90, 180 and 270°, (b) For DC power lines: ±0.5 kV test voltage in open circuit between line and earth and ±0.5 kV between lines (pulse 1.2 µs / 50 µs) with a rise time (Tr) of 1.2 µs, and a hold time (Th) of 50 µs. Each surge shall be applied five times with a maximum delay of 1 minute."
<PARAGRAPH 7.9.2.2.>,"The vehicle representative of its type shall be considered as complying with immunity requirements if, during the tests performed in accordance with Annex-16, there shall be no degradation of performance of ""immunity related functions"", according to Paragraph-2.2. of Annex-6."
<PARAGRAPH 7.10.>,Specifications concerning broadband electromagnetic interference caused by ESAs
<PARAGRAPH 7.10.1.>,Method of measurement The electromagnetic radiation generated by the ESA representative of its type shall be measured by the method described in Annex-7.
<PARAGRAPH 7.10.2.>,ESA broadband type approval limits
<PARAGRAPH 7.10.2.1.>,"If measurements are made using the method described in Annex-7, the limits shall be 62 to 52 dBµV/m in the 30 to 75 MHz frequency band, this limit decreasing logarithmically with frequencies above 30 MHz, and 52 to 63 dBµV/m in the 75 to 400 MHz band, this limit increasing logarithmically with frequencies above 75 MHz as shown in Annex-6. In the 400 to 1,000 MHz frequency band the limit remains constant at 63 dBµV/m."
<PARAGRAPH 7.10.2.2.>,"On the ESA representative of its type, the measured values, expressed in dBµV/m, shall be below the type approval limits."
<PARAGRAPH 7.11.>,Specifications concerning emission of harmonics on AC power lines from ESAs
<PARAGRAPH 7.11.1.>,Method of measurement The harmonics emission on AC power lines generated by the ESA representative of its type shall be measured using the method described in Annex-17. The method of measurement shall be defined by the manufacturer in accordance with the Technical Service.
<PARAGRAPH 7.11.2.>,ESA type approval limit
<PARAGRAPH 7.11.2.1.>,"If measurements are made using the method described in Annex-17, the limits -3-2 and given in Table_10. Table_10 Maximum allowed harmonics (input curr Harmonic number n Maximum authorized harmonic current A Odd harmonics 3 2.3 5 1.14 7 0.77 9 0.40 11 0.33 13 0.21 0.15x15/n Even harmonics 2 1.08 4 0.43 6 0.30 0.23x8/n"
