paragraph,Text
<PARAGRAPH 5.2.4.2.>,"The ISOFIX top tether anchorage zone may be alternatively located with the aid of the Fixture ""ISO/F2"" (B), as defined in Regulation-No._16 (Annex-17, Annex-2, Figure_2), in an ISOFIX position equipped with ISOFIX low anchorages as shown in Figure_11 of Annex-9. The seating position shall be the seat's rearmost, down most position with the seat back in its nominal position, or as recommended by the vehicle manufacturer. In the side view, the ISOFIX top tether anchorage shall lie behind the ""ISO/F2"" (B) fixture rear face. The intersection between the ""ISO/F2"" (B) fixture rear face and the horizontal line (Annex-9, Figure_11, reference 3) containing the last rigid point of a hardness greater than 50 Shore A at the top of the seat back defines the reference point 4 (Annex-9, Figure_11) on the centreline of the ""ISO/F2"" (B) fixture. At this reference point, a maximum angle of 45° above the horizontal line defines the upper limit of the top tether anchorage zone. In the top view, at the reference point 4 (Annex-9, Figure_11), a maximum angle of 90° extending rearward and laterally and in the rear view, a maximum angle of 40° defines 2 volumes which limit the anchorage zone for the ISOFIX top tether. The origin of the ISOFIX top tether strap (5) is located at the intersection of the ""ISO/F2"" (B) fixture with a plane 550 mm distant above the ""ISO/F2"" (B) fixture horizontal face (1) on the ""ISO/F2"" (B) fixture centreline (6). Further, the ISOFIX top tether anchorage shall be more than 200 mm but not more than 2000 mm from the origin of the ISOFIX top tether strap on the rear face of the ""ISO/F2"" (B) fixture, measured along the strap when it is drawn over the seat back to the ISOFIX top tether anchorage."
<PARAGRAPH 5.2.4.3.>,"The portion of the ISOFIX top tether anchorage in a vehicle that is designed to bind with the ISOFIX top tether connector may be located outside the shaded zones referred to Paragraph-5.2.4.1. Paragraph-5.2.4.2. if a location within a zone is not appropriate and the vehicle is equipped with a routing device that Paragraph-5.2.4.3.1. Ensures that the ISOFIX top tether strap functions as if the portion of the anchorage designed to bind with the ISOFIX top tether anchorage were located within the shaded zone; Paragraph-5.2.4.3.2. Is at least 65 mm behind the torso line, in case of a non-rigid webbing-type routing device or a deployable routing device, or at least 100 mm behind the torso line, in the case of a fixed rigid routing device; Paragraph-5.2.4.3.3. When tested after being installed as it is intended to be used, the device is of sufficient strength to withstand, with the ISOFIX top tether anchorage the load referred to in Paragraph-6.6. of this Regulation."
<PARAGRAPH 5.2.4.4.>,"A tether anchorage may be recessed in the seat back, provided that it is not in the strap wrap-around area at the top of the vehicle seat back."
<PARAGRAPH 5.2.4.5.>,"The ISOFIX top tether anchorage shall have dimensions to permit the attachment of an ISOFIX top tether hook as specified in Figure_3. Clearance shall be provided around each ISOFIX top tether anchorage to allow latching and unlatching to it. All anchorages located rearward of any ISOFIX anchorages system and which could be used to attach an ISOFIX top tether hook or ISOFIX top tether connector shall be designed to prevent misuse by one or more of the following measures: (a) Designing all such anchorages in the ISOFIX top tether anchorage zone as ISOFIX top tether anchorages; or (b) Marking only the ISOFIX top tether anchorages using one of the symbols, or its mirror image, as set out in Figure_13 of Annex-9; or (c) Marking such anchorages not in accordance with (a) or (b) above with a clear indication that these anchorages should not be used in combination with any ISOFIX anchorages system. For each ISOFIX top tether anchorage under a cover, the cover shall be identified by for example one of the symbols or the mirror image of one of the symbols set out in Figure_13 of Annex-9; the cover shall be removable without the use of tools."
<PARAGRAPH 5.3.>,Minimum number of belt and ISOFIX anchorages to be provided
<PARAGRAPH 5.3.1.>,Any vehicle in categories M and N (except those vehicles of categories M2 or M3 which belong to Classes I or A1) shall be equipped with safety-belt anchorages which satisfy the requirements of this Regulation.
<PARAGRAPH 5.3.1.1.>,"The anchorages of a harness belt system approved as a S-type belt (with or without retractor(s)) according to Regulation-No._16 shall comply with the requirements of Regulation-No._14, but the additional anchorage or anchorages provided for the fitting of a crotch strap (assembly) are exempted from the strength and location requirements of this Regulation."
<PARAGRAPH 5.3.2.>,The minimum number of safety-belt anchorages for each forward rearward and side-facing seating position shall be those specified in Annex-6.
<PARAGRAPH 5.3.3.>,"However, for outboard seating positions, other than front, of vehicles of category N1, shown in Annex-6 and marked with the symbol Ø, two lower anchorages are allowed, where there exists a passage between a seat and the nearest side-wall of the vehicle intended to permit access of passengers to other parts of the vehicle. A space between a seat and the side-wall is considered as a passage if the distance between that side-wall, with all doors closed, and a vertical longitudinal plane passing through the centre line of the seat concerned, measured at the R point position and perpendicularly to the median longitudinal plane of the vehicle is more than 500 mm."
<PARAGRAPH 5.3.4.>,"For the front centre seating positions shown in Annex-6 and marked with the symbol *, two lower anchorages shall be considered adequate where the windscreen is located outside the reference zone defined in Annex-1 to Regulation-No._21; if located inside the reference zone, three anchorages are required. As regards belt anchorages, the windscreen is considered as part of the reference zone when it is capable of entering into static contact with the test apparatus according to the method described in Annex-1 to Regulation-No._21."
<PARAGRAPH 5.3.5.>,In every seating position marked in Annex shall be provided. Two anchorages may be provided if one of the following conditions is fulfilled:
<PARAGRAPH 5.3.5.1.>,"There is a seat or other parts of the vehicle conforming to Regulation-No._80, Annex-1, Paragraph-3.5. directly in front, "
<PARAGRAPH 5.3.5.2.>,"No part of the vehicle is in the reference zone, or capable of being in the reference zone when the vehicle is in motion,"
<PARAGRAPH 5.3.5.3.>,"Parts of the vehicle within the said reference zone comply with the energy absorbing requirements set out in Regulation-No._80, Annex-6."
<PARAGRAPH 5.3.6.>,"For all seats, intended solely for use or seating intended solely for use when the vehicle is stationary as well as for all the seats of any vehicle which are not covered Paragraph-5.3.1. to 5.3.4., no belt anchorages are required. However, if the vehicle is fitted with anchorages for such seats, these anchorages must comply with the provisions of this Regulation. Any anchorage intended solely for use in conjunction with a disabled person's belt, or any other restraint system according to Regulation-No._107, 02 series of amendments, Annex-8, do not need to conform to the requirements of this Regulation."
<PARAGRAPH 5.3.7.>,"In the case of the upper deck of a double-deck vehicle, the requirements for the centre front seating position shall apply also in the outboard front seating positions."
<PARAGRAPH 5.3.8.>,Minimum number of ISOFIX positions to be provided:
<PARAGRAPH 5.3.8.1.>,"Any vehicle of category M1 shall be equipped at least with two ISOFIX positions which satisfy the requirements of this Regulation. At least two of the ISOFIX positions shall be equipped both with an ISOFIX anchorages system and an ISOFIX top tether anchorage. The type and number of ISOFIX fixtures, defined in Regulation-No._16, which can be installed on each ISOFIX position are defined in Regulation-No._16."
<PARAGRAPH 5.3.8.2.>,"Notwithstanding Paragraph-5.3.8.1. if a vehicle is only equipped with one seat row, no ISOFIX position is required."
<PARAGRAPH 5.3.8.3.>,Notwithstanding Paragraph-5.3.8.1. at least one of the two ISOFIX positions systems shall be installed at the second seat row.
<PARAGRAPH 5.3.8.4.>,"Notwithstanding Paragraph-5.3.8.1. vehicles of category M1 need to have only one ISOFIX position system for vehicles with: (a) Not more than two passenger doors and (b) A rear designated seating position for which interference with transmission and/or suspension components prevents the installation of ISOFIX anchorages according to the requirements of Paragraph-5.2.3 and (c) Having a Power to mass ratio index (PMR) exceeding 140 according to the definitions within Regulation-No._51, and with the definition of the Power Mass Ratio (PMR): PMR = (Pn / mt) * 1000 kg/kW where: Pn: maximum (rated) engine power expressed in kW3 mro: mass of a vehicle in running order expressed in kg mt = mro (for vehicles of category M1) and (d) Having an engine developing a maximum (rated) engine power greater than 200 kW3. Such a vehicle needs to have only one ISOFIX anchorages system and an ISOFIX top tether anchorage at a front passenger designated seating position combined with an airbag deactivation device (if that seating position is fitted with an airbag) and a caution label indicating that there is no ISOFIX position system available at the second seat row."
<PARAGRAPH 5.3.8.5.>,"If an ISOFIX anchorages system is installed at a front seating position protected with a frontal airbag, a de-activation device for this airbag shall be fitted."
<PARAGRAPH 5.3.8.6.>,"Notwithstanding Paragraph-5.3.8.1. in case of integrated ""built in"" child restraint system(s) the number of ISOFIX positions to be provided shall be at least two minus the number of the integrated ""built in"" child restraint system(s) of mass groups 0, or 0+, Paragraph-1. 3 (Rated) engine power means the engine power expressed in kW (ECE) and measured by the ECE method pursuant to Regulation-No._85."
<PARAGRAPH 5.3.8.7.>,"Notwithstanding the provision of the Paragraph-5.3.8.1., convertible vehicles as defined in Annex-7, Paragraph-8.1. of the Consolidated Resolution on the Construction of Vehicles (R.E.3)4 with more than one seat row shall be fitted with at least two ISOFIX low anchorages. In case where an ISOFIX top tether anchorage is provided on such vehicles, it shall comply with the suitable provisions of this Regulation."
<PARAGRAPH 5.3.9.>,"In the case of seats capable of being turned to or placed in other orientations, for use when the vehicle is stationary, the requirements of Paragraph-5.3.1. shall apply only to those orientations designated for normal use when the vehicle is travelling on a road, in accordance with this Regulation. A note to this effect shall be included in the information document."
<PARAGRAPH 5.4.>,"Location of belt anchorages (see Annex-3, Figure_1.)"
<PARAGRAPH 5.4.1.>,General
<PARAGRAPH 5.4.1.1.>,The belt anchorages for any one belt may be located either wholly in the vehicle structure or in the seat structure or any other part of the vehicle or dispersed between these locations.
<PARAGRAPH 5.4.1.2.>,"Any one belt anchorage may be used for attaching the ends of two adjacent safety-belts, provided that the test requirements are met."
<PARAGRAPH 5.4.2.>,Location of the effective lower belt anchorage
<PARAGRAPH 5.4.2.1.>,"Front seats, vehicle category M1 In motor vehicles of category M1 the angle 1 (other than buckle side) shall be 2 (buckle side) shall be within the range of 45 to 80 degrees. Both angle requirements shall be valid for all normal travelling positions of the front seats. Where at least one of the 1 2 is constant (e.g. anchorage fixed at the seat) in all normal positions of use, its value shall be 60 ± 10°. In the case of adjustable seats with an adjusting device as described in Paragraph-2.12. with a seatback angle of less than 20° (see Annex-3, Figure value (30°) stipulated above, provided it is not less than 20° in any normal position of use."
<PARAGRAPH 5.4.2.2.>,"Rear seats, vehicle category M1 In motor vehicles of category M1 the angles 1 2 shall be within the range of 30 to 80 degrees for all rear seats. If rear seats are adjustable the above angles shall be valid for all normal travelling positions."
<PARAGRAPH 5.4.2.3.>,"Front seats, vehicle categories other than M1 In motor vehicles of categories other than M1 1 2 must be between 30 and 80 degrees for all normal travelling positions of the front seats. Where in the case of front seats of vehicles having a maximum vehicle mass not exceeding 3.5 tonnes at least one of the angl1 2 is constant in all normal positions of use, its value shall be 60 ± 10° (e.g. anchorage fixed at the seat). 4 Document ECE/TRANS/WP29/78/Rev.2, para.2."
<PARAGRAPH 5.4.2.4.>,"Rear seats and special front or rear seats, vehicle categories other than M1 In vehicles of categories other than M1, in the case of: (a) Bench seats, (b) Adjustable seats (front and rear) with an adjusting device as described in Paragraph-2.12. with a seatback angle of less than 20° (see Annex-3, Figure_1), and (c) Other rear seats, Angles 1 2 may be between 20° and 80° in any normal position of use. Where in the case of front seats of vehicles having a maximum vehicle mass not exceeding 3.5 1 2 is constant in all normal positions of use, its value shall be 60 ± 10° (e.g. anchorage fixed at the seat). In the case of seats, other than front seats, of vehicles in categories M2 and M31 2 shall be between 45 and 90 degrees for all normal positions of use."
<PARAGRAPH 5.4.2.5.>,"The distance between the two vertical planes parallel to the median vertical longitudinal plane of the vehicle and each passing through a different one of the two effective lower belt anchorages L1 and L2 of the same safety-belt shall not be less than 350 mm. In the case of side-facing seats the distance between the two vertical planes parallel to the median vertical longitudinal plane of the seat and each passing through a different one of the two effective lower belt anchorages L1 and L2 of the same safety-belt shall not be less than 350 mm. In the case of any central seating positions in rear rows of seats of vehicles of category M1 and N1, the above-mentioned distance shall be not less than 240 mm, provided that it is not possible to exchange the centre rear seat with any of the other seats of the vehicle. The median longitudinal plane of the seat shall pass between points L1 and L2 and shall be at least 120 mm from these points."
<PARAGRAPH 5.4.3.>,Location of the effective upper belt anchorages (see Annex-3)
<PARAGRAPH 5.4.3.1.>,"If a strap guide or similar device is used which affects the location of the effective upper belt anchorage, this location shall be determined in a conventional way by considering the position of the anchorage when the longitudinal centre line of the strap passes through a point J1 defined successively from the R point by the following three segments: RZ: A segment of the torso line measured in an upward direction from R and 530 mm long; ZX: A segment perpendicular to the median longitudinal plane of the vehicle, measured from point Z in the direction of the anchorage and 120 mm long; XJ1: A segment perpendicular to the plane defined by segments RZ and ZX, measured in a forward direction from point X and 60 mm long. Point J2 is determined by symmetry with point J1 about the longitudinal vertical plane passing through the torso line described in Paragraph-5.1.2. of the manikin positioned in the seat in question. Where a two-door configuration is used to provide access to both the front and rear seats and the upper anchorage is fitted to the ""B"" post, the system must be designed so as not to impede access to or egress from the vehicle."
<PARAGRAPH 5.4.3.2.>,"The effective upper anchorage shall lie below the plane FN, which runs perpendicular to the longitudinal median plane of the seat and makes an angle of 65° with the torso line. The angle may be reduced to 60° in the case of rear seats. The plane FN shall be so placed as to intersect the torso line at a point D such that DR = 315 mm + 1.8 S. 675 mm."
<PARAGRAPH 5.4.3.3.>,"The effective upper belt anchorage shall lie behind a plane FK running perpendicular to the longitudinal median plane of the seat and intersecting the torso line at an angle of 120° at a point B such that BR = 260 mm + S. Where S 280 mm, the manufacturer may use BR = 260 mm + 0.8 S at his discretion."
<PARAGRAPH 5.4.3.4.>,The value of S shall not be less than 140 mm.
<PARAGRAPH 5.4.3.5.>,The effective upper belt anchorage shall be situated to the rear of a vertical plane perpendicular to the median longitudinal plane of the vehicle and passing through the R point as shown in Annex-3.
<PARAGRAPH 5.4.3.6.>,The effective upper belt anchorage shall be situated above a horizontal plane passing through point C defined in Paragraph-5.1.4.
<PARAGRAPH 5.4.3.7.>,In addition to the upper anchorage specified in Paragraph-5.4.3.1. other effective upper anchorages may be provided if one of the following conditions is satisfied:
<PARAGRAPH 5.4.3.7.1.>,The additional anchorages comply with the requirements of Paragraph-5.4.3.1. to Paragraph-5.4.3.6. 
<PARAGRAPH 5.4.3.7.2.>,"The additional anchorages can be used without the aid of tools, comply with the requirements of Paragraph-5.4.3.5. Paragraph-5.4.3.6. and are located in one of the areas determined by shifting the area shown in Figure_1 of Annex-3 of this Regulation, 80 mm upwards or downwards in a vertical direction."
<PARAGRAPH 5.4.3.7.3.>,"The anchorage(s) is/are intended for a harness belt, complies/comply with the requirements laid down in Paragraph-5.4.3.6. if it lie(s) behind the transverse plane passing through the reference line and is/are located:"
<PARAGRAPH 5.4.3.7.3.1.>,"In the case of a single anchorage, within the area common to two dihedrals defined by the verticals passing through points J1 and J2 as defined in Paragraph-5.4.3.1. and whose horizontal sections are shown in Figure_2 of Annex-3 of this Regulation;"
<PARAGRAPH 5.4.3.7.3.2.>,"In the case of two anchorages, within whichever of the above defined dihedrals is suitable, provided that each anchorage is not more than 50 mm distant from the symmetrically-located, mirror-image position of the other anchorage about plane P, as defined in Paragraph-5.1.6. of the seat in question."
<PARAGRAPH 5.5.>,Dimensions of threaded anchorage holes
<PARAGRAPH 5.5.1.>,An anchorage shall have a threaded hole of 7/16 inch (20 UNF 2B).
<PARAGRAPH 5.5.2.>,"If the vehicle is fitted by the manufacturer with safety-belts which are attached to all anchorages prescribed for the seat in question, these anchorages need not meet the requirement set out in Paragraph-5.5.1., provided that they comply with the other provisions of this Regulation. In addition, the requirement set out in Paragraph-5.5.1. shall not apply to additional anchorages which meet the requirement set out in Paragraph-5.4.3.7.3."
<PARAGRAPH 5.5.3.>,It shall be possible to remove the safety-belt without damaging the anchorage.
<PARAGRAPH 6.>,Tests
<PARAGRAPH 6.1.>,General tests for seat belt anchorages
<PARAGRAPH 6.1.1.>,"Subject to application of the provisions of Paragraph-6.2., and at the request of the manufacturer;"
<PARAGRAPH 6.1.1.1.>,The tests may be carried out either on a vehicle structure or on a completely finished vehicle;
<PARAGRAPH 6.1.1.2.>,"The tests may be restricted to the anchorages relating to only one seat or one group of seats on the condition that: (a) The anchorages concerned have the same structural characteristics as the anchorages relating to the other seats or group of seats; and (b) Where such anchorages are fitted totally or partially on the seat or group of seats, the structural characteristics of the seat or group of seats are the same as those for the other seats or groups of seats."
<PARAGRAPH 6.1.1.3.>,Windows and doors may be fitted or not and closed or not;
<PARAGRAPH 6.1.1.4.>,Any fitting normally provided and likely to contribute to the rigidity of the vehicle structure may be fitted.
<PARAGRAPH 6.1.2.>,"The seats shall be fitted and placed in the position for driving or use chosen by the technical service responsible for conducting approval tests to give the most adverse conditions with respect to the strength of the system. The position of the seats shall be stated in the report. The seat-back shall, if its inclination is adjustable, be locked as specified by the manufacturer or, in the absence of any such specification, in a position corresponding to an effective seat-back angle as close as possible to 25° for vehicles of categories M1 and N1 and to 15° for vehicles of all other categories."
<PARAGRAPH 6.2.>,Securing the vehicle for seat belt anchorages tests and for ISOFIX anchorages tests
<PARAGRAPH 6.2.1.>,The method used to secure the vehicle during the test shall not be such as to strengthen the seat belt anchorages or the ISOFIX anchorages and their anchorage area or to lessen the normal deformation of the structure.
<PARAGRAPH 6.2.2.>,A securing device shall be regarded as satisfactory if it produces no effect on an area extending over the whole width of the structure and if the vehicle or the structure is blocked or fixed in front at a distance of not less than 500 mm from the anchorage to be tested and is held or fixed at the rear not less than 300 mm from that anchorage.
<PARAGRAPH 6.2.3.>,"It is recommended that the structure should rest on supports arranged approximately in line with the axes of the wheels or, if that is not possible, in line with the points of attachment of the suspension."
<PARAGRAPH 6.2.4.>,If a securing method other than that prescribed in Paragraph-6.2.1. to
<PARAGRAPH 6.2.3.>,"of this Regulation is used, evidence must be furnished that it is equivalent."
<PARAGRAPH 6.3.>,General test requirements for seat belt anchorages
<PARAGRAPH 6.3.1.>,"All the belt anchorages of the same group of seats shall be tested simultaneously. However, if there is a risk that non-symmetrical loading of the seats and/or anchorages may lead to failures, an additional test may be carried out with non-symmetrical loading."
<PARAGRAPH 6.3.2.>,"The tractive force shall be applied at an angle of 10 degrees ±5° above the horizontal, in a plane parallel to the median longitudinal plane of the vehicle. A preload of 10 per cent with a tolerance of ±30 per cent of the target load shall be applied; the load shall be increased to 100 per cent of the relevant target load."
<PARAGRAPH 6.3.3.>,"Full application of the load shall be achieved as rapidly as possible, and within a maximum load application time of 60 seconds. However, the manufacturer may request the application of the load to be achieved within 4 seconds. The belt anchorages must withstand the specified load for not less than 0.2 second."
<PARAGRAPH 6.3.4.>,"Traction devices to be used in the tests described in Paragraph-6.4. below are shown in Annex-5. The devices shown in Annex-5, Figure_1 are placed onto the seat cushion and then, when possible, pushed back into the seat back while the belt strap is pulled tight around it. The device shown in Annex-5, Figure_2 is placed in position, the belt strap is fitted over the device and pulled tight. No preload beyond the minimum necessary for correct positioning of the test device shall be introduced to safety-belt anchorages during this operation. The traction device of either 254 mm or 406 mm used at each seating position shall be such that its width is as close as possible to the distance between the lower anchorages. The positioning of the traction device shall avoid any mutual influences during the pull test which adversely affects the load and load distribution."
<PARAGRAPH 6.3.5.>,The belt anchorages for seats for which upper belt anchorages are provided shall be tested under the following conditions:
<PARAGRAPH 6.3.5.1.>,"Front outboard seats: The belt anchorages shall be submitted to the test prescribed in Paragraph-6.4.1. in which the loads are transmitted to them by means of a device reproducing the geometry of a three-point belt equipped with a retractor having a pulley or strap guide at the upper belt anchorage. In addition, if the number of anchorages is more than that prescribed in Paragraph-5.3., these anchorages shall be subjected to the test specified in Paragraph-6.4.5., in which the loads shall be transmitted to the anchorages by means of a device reproducing the geometry of the type of safety-belt intended to be attached to them."
<PARAGRAPH 6.3.5.1.1.>,"In the case where the retractor is not attached to the required outboard lower belt anchorage or in the case where the retractor is attached to the upper belt anchorage, the lower belt anchorages shall also be submitted to the test prescribed in Paragraph-6.4.3."
<PARAGRAPH 6.3.5.1.2.>,In the above case the tests prescribed in Paragraph-6.4.1. Paragraph-6.4.3. can be performed on two different structures if the manufacturer so requests.
<PARAGRAPH 6.3.5.2.>,"Rear outboard seats and all centre seats: The belt anchorages shall be subjected to the test prescribed in Paragraph-6.4.2. in which the loads are transmitted to them by means of a device reproducing the geometry of a three-point safety-belt without a retractor, and to the test prescribed in Paragraph-6.4.3., in which the loads are transmitted to the two lower belt anchorages by means of a device reproducing the geometry of a lap belt. The two tests can be performed on two different structures if the manufacturer so requests."
