Index,Text
48-2.6.5,Securing the vehicle for seat belt anchorages tests and for ISOFIX anchorages tests
48-2.6.5.1,The method used to secure the vehicle during the test shall not be such as to strengthen the seat belt anchorages or the ISOFIX anchorages and their anchorage area or to lessen the normal deformation of the structure.
48-2.6.5.2,A securing device shall be regarded as satisfactory if it produces no effect on an area extending over the whole width of the structure and if the vehicle or the structure is blocked or fixed in front at a distance of not less than 500 mm from the anchorage to be tested and is held or fixed at the rear not less than 300 mm from that anchorage.
48-2.6.5.3,"It is recommended that the structure should rest on supports arranged approximately in line with the axes of the wheels or, if that is not possible, in line with the points of attachment of the suspension."
48-2.6.5.4,If a securing method other than that prescribed  Paragraph- 6.5.1. to
48-2,"6.5.3. of this Regulation is used, evidence must be furnished that it is equivalent."
48-2.7,"Requirements for the installation of safety-belts and restraint systems and i-Size child restraint systems Vehicles of category M1 shall be equipped with ISOFIX to meet this requirement. If vehicles of category N equipped with ISOFIX, it shall comply with this requirement.)"
48-2.7.1,Declaration of design compliance of child restraint systems
48-2.7.1.1,"The vehicle manufacturer shall include in the vehicle handbook simple advice to the vehicle user on the suitability of each passenger seating position for the fitting of child restraint systems. This information shall be given by pictograms, or in the Chinese language. For each forward-facing passenger seating position, and for each specified ISOFIX position, the vehicle manufacturer shall indicate: (a) If the seating position is suitable for child restraints of the ""universal"" category ( Paragraph-), and/or (b) If the seating position is suitable for i-size child restraint systems ( Paragraph-), and/or (c) If the seating position is suitable for child restraint systems other than those specified above ( Paragraph-). If a seating position is only suitable for use with forward-facing child restraint systems, this shall also be indicated in the vehicle handbook. In addition to the above defined information for the vehicle user, the vehicle manufacturers shall make available the information as defined in table 2. For example, this information can be included in separate Annexes of the vehicle handbook, or in technical descriptions of the vehicle or on a dedicated webpage."
48-2.7.1.2,"A child restraint system of the universal category means a child restraint approved to the ""universal"" category of UN/ECE Regulation No. 44. Seating positions, which are indicated by the vehicle manufacturer as being suitable for the installation of child  restraints systems shall comply with the provisions  Paragraph-."
48-2.7.1.3,"An ISOFIX child restraint shall be approved to UN/ECE Regulation No. 44 or to Regulation No. 129. ISOFIX positions, which are indicated by the vehicle manufacturer as being suitable for the installation of ISOFIX child restraints systems shall comply with the provisions  Paragraph-."
48-2.7.1.4,"An i-Size child restraint means a child restraint approved to the i-Size category of UN/ECE Regulation No. 129. Seating positions, which are indicated by the vehicle manufacturer as being suitable for the installation of i-Size child restraints systems shall comply with the provisions  Paragraph-."
48-2.7.2,For adult occupants of power-driven vehicles on forward facing seats and for the installation of isofix child restraint systems
48-2.7.2.1,"Provisions concerning the installation of ""universal"" category child restraint systems installed with the safety-belt equipment of the vehicle"
48-2.7.2.1.1,General
48-2.7.2.1.1.1,"The test procedure and the requirements in this appendix shall be used to determine the suitability of seat positions for the installation of child restraints of the ""universal"" category."
48-2.7.2.1.1.2,The tests may be carried out in the vehicle or in a representative part of the vehicle.
48-2.7.2.1.2,Test procedure
48-2.7.2.1.2.1,Adjust the seat to its fully rearward and lowest position.
48-2.7.2.1.2.2,"Adjust the seat-back angle to the manufacturer's design position. In the absence of any specification, an angle of 25 degrees from the vertical, or the nearest fixed position of the seat-back, should be used."
48-2.7.2.1.2.3,Set the shoulder anchorage to the lowest position.
48-2.7.2.1.2.4,Place a cotton cloth on the seat-back and cushion.
48-2.7.2.1.2.5,Place the fixture (as described in figure 8) on the vehicle seat.
48-2.7.2.1.2.6,"If the seating position is intended to accommodate a forward-facing or rearward-facing universal restraint system, proceed according  Paragraph-. Paragraph-. Paragraph-. Paragraph-. Paragraph-. If the seating position is intended to accommodate only a forward-facing universal restraint system, proceed according  Paragraph-. Paragraph-. Paragraph-. Paragraph-. Paragraph-."
48-2.7.2.1.2.6.1,"Arrange the safety-belt strap around the fixture in approximately the correct position as shown in figures 9 and 10, then latch the buckle."
48-2.7.2.1.2.6.2,"Arrange the safety-belt lap strap approximately in the correct position around the lower part of the fixture of 150 mm radius as shown in figure 10, then latch the buckle. "
48-2.7.2.1.2.7,Ensure that the fixture is located with its vertical plane of symmetry within +/-25 mm of the vertical plane of symmetry of the seating position.
48-2.7.2.1.2.8,"Ensure that all webbing slack is removed. Use sufficient force to remove the slack, do not attempt to tension the webbing."
48-2.7.2.1.2.9,"Push rearwards on the centre of the front of the fixture with a force of 100 N +/- 10 N, applied parallel to the lower surface, and remove the force."
48-2.7.2.1.2.10,"Push vertically downwards on the centre of the upper surface of the fixture with a force of 100 N +/- 10 N, and remove the force."
48-2.7.2.1.3,Requirements
48-2.7.2.1.3.1,"The base of the fixture shall contact both the forward and rearward parts of the seat cushion surface. If such contact does not occur due to the belt access gap in the test fixture, this gap may be covered in line with the bottom surface of the test fixture."
48-2.7.2.1.3.2,The lap portion of the belt shall touch the fixture on both sides at the rear of the lap belt path (see Figure 10). The seat belt webbing shall always cover the points BP on the left and right ends of the curved edge; the exact position of point BP on the curved edge is indicated in detail W of Figure 8.
48-2.7.2.1.3.3,"Should the above requirements not be met with the adjustments indicated  Paragraph- 7.2.1.2.1. Paragraph- 7.2.1.2.2. Paragraph- 7.2.1.2.3., the seat, seat-back and safety-belt anchorages may be adjusted to an alternative position designated by the manufacturer for normal use at which the above installation procedure shall be repeated and the requirements again verified and met. This alternative position shall be included as an information in the table 2."
48-2.7.2.2,Provisions concerning the installation of forward-facing and rearward-facing ISOFIX child restraint systems of universal and semi-universal categories installed on ISOFIX or i-Size position
48-2.7.2.2.1,General
48-2.7.2.2.1.1,"The test procedure and the requirements in this appendix shall be used to determine the suitability of ISOFIX positions for the installation of ISOFIX child restraint systems of universal and semi-universal categories, as well as to determine the suitability of i-Size seating positions for installing i-Size child restraint systems."
48-2.7.2.2.1.2,"The tests may be carried out in the vehicle or in a representative part of the vehicle. For i-Size seating positions, compliance with the i-Size support leg installation requirements may be assessed by a physical test, computer simulation or representative drawings."
48-2.7.2.2.2,"Test procedure  ISOFIX positions in the vehicle, defined by the vehicle manufacturer shall be checked to ensure that the CRF listed  Paragraph- can be accommodated. Where the vehicle manufacturer has indicated that the ISOFIX position(s) will accommodate a particular CRF, then it shall be assumed that smaller CRFs of the same orientation may be accommodated. i-Size seating positions, defined by the vehicle manufacturer, shall be checked to ensure that it is possible to accommodate both the ISO/R2 and the ISO/F2X child restraint fixtures ( Paragraph-) including the i-Size support leg installation assessment volume. For both, ISOFIX and i-size position(s), the following procedure shall apply:"
48-2.7.2.2.2.1,"When checking a CRF on a seat, with or without i-Size support leg installation assessment volume, this seat may be adjusted longitudinally to its rearmost position and in its lowest position."
48-2.7.2.2.2.2,"Adjust the seat-back angle to the manufacturer's design position and the head restraint in the lowest and rearmost position. In the absence of any specification an angle of the seat-back corresponding to a torso angle of 25 degrees from the vertical, or the nearest fixed position of the seat-back, shall be used. When checking a CRF on a rear seat, with or without i-Size support leg installation assessment volume, the vehicle seat located in front of this rear seat may be adjusted longitudinally forward but not further than the mid position between its rearmost and fore most positions. The seat backrest angle may also be adjusted, but not to a more upright angle than corresponding to a torso angle of 15 degrees ."
48-2.7.2.2.2.3,Place a cotton cloth on the seat-back and cushion.
48-2.7.2.2.2.4,"Place the CRF, with or without i-Size support leg installation assessment volume, on the ISOFIX position."
48-2.7.2.2.2.5,"Push, towards ISOFIX anchorages system, on the center between the ISOFIX anchorages with a force of 100 N +/- 10 N, applied parallel to the lower surface, and remove the force."
48-2.7.2.2.2.6,"Attach the CRF, with or without i-Size support leg installation assessment volume, to the ISOFIX anchorages system."
48-2.7.2.2.2.7,"Push vertically downwards on the centre of the upper surface of the fixture with a force of 100 N +/- 10 N, and remove the force."
48-2.7.2.2.3,"Requirements The following testing conditions only apply for the CRF(s), with or without i-Size support leg installation assessment volume, when accommodated in the ISOFIX and/or i-Size position. It is not required that the CRF(s), with or without i-Size support leg installation assessment volume, shall be possible to move in and out of the ISOFIX and/or i-Size position under these conditions."
48-2.7.2.2.3.1,"It has to be possible to accommodate the CRF(s), with or without i-Size support leg installation assessment  volume, without interference with the vehicle interior. The CRF base shall have a pitch angle of 15 degrees +/- 10 degrees, above the horizontal plane passing through the ISOFIX anchorages system."
48-2.7.2.2.3.2,"The ISOFIX top tether anchorage, if any, shall remain accessible."
48-2.7.2.2.3.3,"Should the above requirements not be met with the adjustments indicated  Paragraph- 7.2.2.2. above, the seats, the seat-backs, the head restraints may be adjusted to alternative positions designated by the manufacturer for normal use following which the above installation procedure shall be repeated and the requirements verified and met. These alternative positions shall be included as information in table 3. If passenger seats in front of i-Size seating positions may also be displaced to a position forward of the normal position of use. In such cases, the vehicle manufacturer shall provide information in the vehicle handbook, that the respective passenger seat shall not be occupied in such positions of displacement."
48-2.7.2.2.3.4,"Should the above requirements not be fulfilled when some removable interior fittings were present, such fittings may be removed and then requirements  Paragraph- 7.2.2.3 have to be verified again and fulfilled. In such a case corresponding information shall be included in table 3 and/or table 4."
48-2.7.2.3,ISOFIX child restraint system size classes and fixtures A - ISO/F3: Full-Height Forward Facing toddler CRS B - ISO/F2: Reduced-Height Forward Facing toddler CRS B1 - ISO/F2X: Reduced-Height Forward Facing toddler CRS C - ISO/R3: Full-Size Rearward Facing toddler CRS D - ISO/R2: Reduced-Size Rearward Facing toddler CRS E - ISO/R1: Rearward Facing infant CRS F - ISO/L1: Left Lateral Facing position CRS (carry-cot) G - ISO/L2: Right Lateral Facing position CRS (carry-cot) The fixtures below shall be constructed with a mass between 5 and 15 kg and shall be of suitable durability and stiffness to satisfy the functional requirements.  ISOFIX child restraint system size classes and fixtures
48-2.7.3,Minimum number of belt and ISOFIX anchorages to be provided
48-2.7.3.1,"Any vehicle of category M1, except for the first row of seats shall be equipped at least with two ISOFIX positions which satisfy the requirements of this Regulation. At least two of the ISOFIX positions shall be equipped both with an ISOFIX anchorages system and an ISOFIX top tether anchorage. The first ISOFIX position shall allow at least the installation of one out of the three forward-facing fixtures as defined  Paragraph-; the second ISOFIX position shall allow at least the installation of one out of the three rear-facing fixtures as defined  Paragraph-. For this second ISOFIX position, in case where the installation of the rear-facing fixture is not possible on the second row of seats of the vehicle due to its design, the installation of one out of the six fixtures is allowed in any position of the vehicle."
48-2.7.3.2,"Notwithstanding Paragraph- 7.3.1 if a vehicle is only equipped with one seat row, no ISOFIX position is required."
48-2.7.3.3,At least one of the two ISOFIX positions systems shall be installed at the second seat row.
48-2.7.3.4,The vehicles of category M1 need to have only one ISOFIX position system for vehicles with:
48-2.7.3.4.1,"Not more than two passenger doors Paragraph- A rear designated seating position for which interference with transmission and/ or suspension components prevents  the installation of ISOFIX anchorages according to the requirements  Paragraph- 7.4.2. Paragraph- Having a Power to mass ratio index (PMR) exceeding 140, and with the definition of the Power Mass Ratio (PMR): PMR = (Pn / mt) * 1000 kg/kW where: Pn = maximum (rated) engine power expressed in kW mro = mass of a vehicle in running order expressed in kg mt = mro (for vehicles of category M1) Paragraph- Having an engine developing a maximum (rated) engine power greater than 200 kW. Such vehicles shall also comply with the requirement that the front passenger seating position do not installed child restraint system, and reported in documents as specified  Paragraph-."
48-2.7.3.5,"If an ISOFIX anchorages system is installed at a front seating position protected with a frontal airbag, a de-activation device for this airbag shall be fitted."
48-2.7.3.6,"In case of integrated ""built in"" child restraint system(s) the number of ISOFIX positions to be provided shall be at least two minus the number of the integrated ""built in"" child restraint system(s) of mass groups 0, or 0+, or ."
48-2.7.3.7,"The convertible vehicles with more than one seat row shall be fitted with at least two ISOFIX low anchorages. In case where an ISOFIX top tether anchorage is provided on such vehicles, it shall comply with the suitable provisions of this Regulation."
48-2.7.3.8,"If a vehicle is only equipped with one seat position per row, only one ISOFIX position is required in the passenger position. In case where an ISOFIX top tether anchorage is provided on such vehicles, it shall comply with the suitable provisions of this Regulation. However, where it is not possible to install even the smallest forward-facing ISOFIX fixture (as defined  Paragraph-.) in the passenger seating position, then no ISOFIX position shall be required (it could exempt from Paragraph- 7.3.1), provided that a child restraint system is specified for that vehicle."
48-2.7.3.9,"Notwithstanding Paragraph-, ISOFIX positions are not required in child-only vehicle, ambulances or hearses as well as vehicles intended for use by the armed services, fire services and forces responsible for maintaining public order."
48-2.7.3.10,"Notwithstanding the provisions  Paragraph- to 48-2.7.3.4, one or more of the mandatory ISOFIX positions may be replaced by i-Size seating positions."
48-2.7.4,General specifications
48-2.7.4.1,"Any ISOFIX anchorages system and any ISOFIX top tether anchorage, installed or intended to be installed, for ISOFIX child  restraint systems, as well as the vehicle floor contact surface of any i-Size seating positions, shall be so designed, made and situated as to:"
48-2.7.4.1.1,"Any ISOFIX anchorages system and any top tether anchorage, as well as the vehicle floor contact surface of any i-Size seating positions, shall enable the vehicle, in normal use, to comply with the provisions of this Regulation. Any ISOFIX anchorages system and ISOFIX top tether anchorage which could be added on any vehicle shall also comply with the provisions of this Regulation. Consequently, such anchorages shall be described on the application document for type approval."
48-2.7.4.1.2,ISOFIX anchorages system and ISOFIX top tether anchorage resistance are designed for any ISOFIX child restraint systems of group of mass 0; 0+; as defined in UN Regulation No. 44.
48-2.7.4.1.3,"An ISOFIX anchorage system, ISOFIX top tether anchorage and vehicle floor contact surface of i-Size seating positions shall be designed for i-Size child restraint system."
48-2.7.4.2,"ISOFIX anchorage systems, design and positioning:"
48-2.7.4.2.1,Any ISOFIX anchorages system shall be 6 mm +/- 0.1 mm diameter transverse horizontal rigid bar(s) which cover(s) two zones of 25 mm minimum effective length located on the same axis as defined in figure 11.
48-2.7.4.2.2,"Any ISOFIX anchorages system installed on a vehicle seating position shall be located not less than 120 mm behind the design H-point, measured horizontally and up to the centre of the bar."
48-2.7.4.2.3,"For any ISOFIX anchorages system installed in the vehicle, it shall be verified the possibility to attach the ISOFIX child restraint fixture either ""ISO/F2"" (B) or ""ISO/ F2X(B1)"" as defined by the vehicle manufacturer, as defined in figure 22 and figure 23. I-Size positions shall accommodate ISOFIX child restraint fixtures of size classes ""ISO/F2X"" (B1), and ""ISO/R2"" (D) together with the support leg installation assessment volume, as defined in 48-2.7.2.2."
48-2.7.4.2.4,"The bottom surface of the ISOFIX child restraint fixture as defined by vehicle manufacturer , shall have attitude angles within the following limits, angles measured relatively to the vehicle reference planes:"
48-2.7.4.2.4.1,"Pitch: 15 degrees +/- 10 degrees Paragraph- Roll: 0 degrees +/- 5 degrees Paragraph- Yaw: 0 degrees +/- 10 degrees For i-Size positions, providing the limits specified  Paragraph-. are not exceeded, it is acceptable for the shortest support-leg length, according to the support-leg foot assessment volume, to result in a pitch angle greater than would otherwise be imposed by the vehicle seat or structure. It shall be possible to install the ISOFIX child restraint fixture  under the increased pitch angle."
48-2.7.4.2.5,"ISOFIX anchorage systems shall be permanently in position or storable. In case of storable anchorages, the requirements relating to ISOFIX anchorages system shall be fulfilled in the deployed position."
48-2.7.4.2.6,"Each ISOFIX low anchorage bar (when deployed for use) or each permanently installed guidance device shall be visible, without the compression of the seat cushion or seat back, when the bar or the guidance device is viewed, in a vertical longitudinal plane passing through the centre of the bar or of the guidance device, along a line making an upward angle of 30 degrees with a horizontal plane. As an alternative to the above requirement, the vehicle shall be permanently marked adjacent to each bar or guidance device. This marking shall consist in one of the following, at the choice of the manufacturer."
48-2.7.4.2.6.1,"As a minimum, the symbol figure 12 consisting of a circle with a diameter of minimum 13 mm and containing a pictogram, meeting the following conditions:"
48-2.7.4.2.6.1.1,the pictogram shall contrast with the background of the circle;
48-2.7.4.2.6.1.2,the pictogram shall be located close to each bar of the system;
48-2.7.4.2.6.2,"The word ""ISOFIX"" in capital letters of at least 6 mm height."
48-2.7.4.2.7,The requirements  Paragraph- do not apply to the i-Size seating position. i-Size seating positions shall be marked according  Paragraph-.
48-2.7.4.3,"ISOFIX top tether anchorages, design and positioning: At the request of the car manufacturer, methods described  Paragraph- 7.4.3.1. Paragraph- 7.4.3.2. can be used alternatively. Method described  Paragraph- 7.4.3.1. can only be used if the ISOFIX position is located on a vehicle seat."
48-2.7.4.3.1,"Subject  Paragraph- 7.4.3.3. Paragraph- 7.4.3.4., the portion of each ISOFIX top tether anchorage that is designed to bind with an ISOFIX top tether connector shall be located not further than 2000 mm far from the shoulder reference point and within the shaded zone, as shown in figures 13 to 17, of the designated seating position for which it is installed, with the reference of a template described in SAE J 826 (July 1995) and shown in figure 18, according to the following conditions:"
48-2.7.4.3.1.1,"The ""H"" point of the template is located at the unique design ""H"" point of the full downward and full rearward position of the seat, except that the template is located laterally midway between the two ISOFIX lower anchorages;"
48-2.7.4.3.1.2,"The torso line of the template is at the same angle to the transverse vertical plane as the seat back in its most upright position, Paragraph- The template is positioned in the vertical longitudinal plane that contains the H-point of the template. "
48-2.7.4.3.2,"The ISOFIX top tether anchorage zone may be alternatively located with the aid of the Fixture ""ISO/F2"" (B), in an ISOFIX position equipped with ISOFIX low anchorages as shown in figure 19. The seating position shall be the seat's rearmost, down most position with the seat back in its nominal position, or as recommended by the vehicle manufacturer. In the side view, the ISOFIX top tether anchorage shall lie behind the ""ISO/F2"" (B) fixture rear face. The intersection between the ""ISO/F2"" (B) fixture rear face and the horizontal line (figure 19, reference 3) containing the last rigid point of a hardness greater than 50 Shore A at the top of the seat back defines the reference point 4 (figure 19) on the centreline of the ""ISO/F2"" (B) fixture. At this reference point, a maximum angle of 45 deg. above the horizontal line defines the upper limit of the top tether anchorage zone. In the top view, at the reference point 4 (figure 19), a maximum angle of 90 deg. extending rearward and laterally and in the rear view, a maximum angle of 40 deg. defines 2 volumes which limit the anchorage zone for the ISOFIX top tether. The origin of the ISOFIX top tether strap (5) is located at the intersection of the ""ISO/ F2"" (B) fixture with a plane 550 mm distant above the ""ISO/F2"" (B) fixture horizontal face (1) on the ""ISO/F2"" (B) fixture centreline (6). Further, the ISOFIX top tether anchorage shall be more than 200 mm but not more than 2000 mm from the origin of the ISOFIX top tether strap on the rear face of the ""ISO/F2"" (B) fixture, measured along the strap when it is drawn over the seat back to the ISOFIX top tether anchorage."
48-2.7.4.3.3,"The portion of the ISOFIX top tether anchorage in a vehicle that is designed to bind with the ISOFIX top tether connector may be located outside the shaded zones referred  Paragraph- 7.4.3.1. Paragraph- 7.4.3.2. if a location within a zone is not appropriate and the vehicle is equipped with a routing device that Paragraph- ensures that the ISOFIX top tether strap functions as if the portion of the anchorage designed to bind with the ISOFIX top tether anchorage were located within the shaded zone;  Paragraph- is at least 65 mm behind the torso line, in case of a non-rigid webbing-type routing device or a deployable routing device, or at least 100 mm behind the torso line, in the case of a fixed rigid routing device;  Paragraph- when tested after being installed as it is intended to be used, the device is of sufficient strength to withstand, with the ISOFIX top tether anchorage the load referred to  Paragraph- 7.6. of this Regulation."
48-2.7.4.3.4,"A tether anchorage may be recessed in the seat back, provided that it is not in the strap wrap-around area at the top of the vehicle seat back."
48-2.7.4.3.5,The ISOFIX top tether anchorage shall have dimensions to permit the attachment of an ISOFIX top tether hook as specified in figure 3. Clearance shall be provided around each ISOFIX top tether anchorage to allow latching and unlatching to it.  All anchorages located rearward of any ISOFIX anchorages system and which could be used to attach an ISOFIX top tether hook or ISOFIX top tether connector shall be designed to prevent misuse by one or more of the following measures:
